Destination Name,Review Head,Review Body,Rating,Date
National Museum of Ethiopia,Interesting ,This place is a main attraction in the city. Start downstairs with Lucy if you wanna best the crowds/school kids. It’s affordable and easy to navigate. The Lucy restaurant next door has great food that’s varied and has a nice atmosphere.,5,December 2018
National Museum of Ethiopia,Seeing Lucy is the highlight,"Like most museums in Addis, this one is also particularly run down. Nevertheless, seeing Lucy (and Ardy) is well worth it. I also really enjoyed the art gallery.",4,December 2018
National Museum of Ethiopia,You can See Our Mother Lucy!!!,"It's a replica, but the real stuff its actually in Addis in a vault. Interesting museum to know a little about the history of Ethiopia. And also it's soooo Cheap!",4,November 2018
National Museum of Ethiopia,There's alot to see here,"At times the lighting was poor, and the interpretitive signs were not always translated or even present.  It seemed like the museum is under-funded based on the condition of the displays and the building.  Nevertheless I am very glad I went.  I learned a lot...",4,November 2018
National Museum of Ethiopia,Go to see Lucy! (You could skip the rest if limited on time),"It is worth checking out to see Lucy. Although Lucy's display could be upgraded with better display and lightning. The rest of the museum can be skipped if you are limited on time. There are some nice contemporary paintings that are admirable, if you are...",3,November 2018
National Museum of Ethiopia,They could make much more of this!,"Lucy is attracting of course many people, but she was not in a very attractive space or very obvious displayed. They could have made much more of it.
Many art works without any explanation.
Run down at the inside.
Toilets were a shame!",3,November 2018
National Museum of Ethiopia,"Lucy , the oldest skeleton in ethiopia.","There was a group of 31 of us, and because we were such a large group we had a guided tour which was really nice, I learned so much. We also had lunch in the restaurant which was really good.",5,November 2018
National Museum of Ethiopia,Not so many exhibits but nice drawings,"Provided some history information, not so many exhibits, not crowded and good place for spending 1-2 hrs there. The drawings on the 3rd floor are nice, recommended! 展品雖然不是很多，有空來逛逛讀讀歷史介紹還是不錯的，增長知識！3樓的展示作品和圖畫是比較近代的，很美，不要錯過！",3,November 2018
National Museum of Ethiopia,Good visit,"Museum is a bit dated, but worth a visit. We enjoyed the museum/exhibits and would reccomend it to anyone looking to add an informative sightseeing stop.  They have your guides available as well.  We didnt do a guided tour so can't comment on that. I...",4,November 2018
National Museum of Ethiopia,Very interesting and informative,"Enjoyed walking round this museum. It is quite basic but interesting facts and detail about ""Lucy"" and some lovely art work. Only ETB20 entrance fee.",4,November 2018
Mount Bwahit,Spectacular Views!,"1.	Introduction
Mt. Bwahit (or Buahit) is the third highest mountain in Ethiopia and the thirteenth highest in Africa.  It lies in the Simien Mountains, a world heritage site.  It is separated from Ras Dashen, Ethiopia’s highest mountain, by 10 miles and a gorge of...",5,February 2019
Harar Jegol Wall,Beautiful City and Great Tour,"We had a great time touring Harar with Nahom.  It is a beautiful city with a rich history, and Nahom was a fun guide and flexible with us, to make sure that we have the best experience.  He speaks great English and was very informative....",5,August 2019
Harar Jegol Wall,Great city tour with Nahom Amde,"We reached out to Nahom (WhatsApp +251920915134) about a city tour after seeing positive reviews about him. We were not disappointed. He took us on a full day tour of Harar, explaining everything in detail and letting us partake in activities (coffee drinking, museums, hyena...",5,September 2019
Harar Jegol Wall,Fascinating Harar,"Harar was fascinating yet we couldn't wait to leave Harar behind only to wish later that we persevered to stay on for longer. 
The city is a melting pot of cultures but our accommodation was just not up to par. We checked in rather late...",5,September 2019
Harar Jegol Wall,Do not book Abdul as a guide,"I spent 3 days in Harar, which is a gorgeous and a must-visit place. My boyfriend and I had read that Abdul (abdulharar@gmail.com or abdulguide808@yahoo.com) was a pretty good and ""decent"" guide. Please, do yourself a favor and do not book his services. The only...",5,September 2019
Harar Jegol Wall,Harar is an unveiling,"Harar was beyond remarkable. But you will need a guide to access the full glory of the place as mentioned by others. 

Our guide was brilliant! Super cool, super knowledgeable, brilliant at creating access to really local experiences like the chat market and lifestock market...",5,September 2019
Harar Jegol Wall,Harar,"Two days I was to me a guide and the friend. Intelligent, well knows the city and sights, well speaks English everything I recommend. Phone number 251952747434. emajeemaje@yahoo.com",5,July 2019
Harar Jegol Wall,harar + guide,"Harar is great to visit and spend time. the city is alive and historic. it has a very nice feel to it. We stayed in Anisa guesthouse and we fortunate to have Nahom as our guide for one aternoon. we wholehartedly recommend him!  

Details: Nahom...",5,July 2019
Harar Jegol Wall,amezingly build architechure,vary unique history with vary unique place and culture still exist all the gate have there own purpose i invite you to take a trip there,4,July 2019
Harar Jegol Wall,I Live in Harar,It's Most Amazing and Historical Place i know. The Story how it was built is also so amazing. Read IT!,5,June 2019
Harar Jegol Wall,Amazing old city and great tour guide - Emaj / Rewda Guesthouse,"We thoroughly enjoyed ourselves at Harar, thanks to our tour guide Emaj. Not only did he make us feel very safe throughout the whole time we were there, he is a great tour guide who knows all the local places and where to get everything...",5,June 2019
Asni Gallery,Does Not exist,"I was looking for this gallery at the location indicated by TripAdvisor, it has relocated some time ago and as reported by local guides subsequently closed for good. The phone is Off.",1,April 2018
Asni Gallery,Best Vegi and Vegan food in Addis,I love going to Asni's for good simple food and best tea! Great paintings to look at and amazing social service too for artist community!,5,April 2017
Asni Gallery,amazing place for vegan Diet.,"Quite and best place to visit in 4KILO area for lunch, after national museum and cathedral church visit.",5,August 2017
Asni Gallery,Nice atmosphere ,"Nice vegetarian restaurant offering a twist on traditional Ethiopian foods and a range of delicious juices, especially recommend the lemonade with honey 👌🏻
Quiet and peaceful atmosphere away from the madness of the city. No signage on the outside of the restaurant so may be...",5,April 2017
Asni Gallery,Great authentic and modified Ethiopian vegetarian dish with gallery,"Great find in rather quiet place away from the crowded city. They serve authentic and modified Ethiopian vegetarian dish with good coffee. They have gallery displaying art works by Ethiopian artists although not year round. The owner Konjit is very friendly, and all the staff...",5,January 2017
Asni Gallery,I love the place,Asni Gallery is a place I love to have breakfast. I love the quiteness and the serives as well as I could enjoy the art as well.,4,September 2016
Asni Gallery,Authentic Ethiopian food as it used to be,"This Gallery is one of my favourites, a classic old time Ethiopian experience with vegetarian food prepared as only Ethiopians can in dishes of long ago.",5,September 2015
Asni Gallery,disappointed,"We went to see the art work, and there were none on display. You should call ahead and ask if they have any exhibitions.",2,July 2016
Asni Gallery,Some peace and quiet in Addis,"Anyone who knows Addis will know that although it offers many interesting experiences, managing your day with traffic and getting to places can be tough. However when you reach Asni Gallery and Restaurant, it is like a spot where you can relax a bit, Sit...",4,September 2015
Asni Gallery,Hidden spot near Arat Kilo in Addis,Great food and service.  Good coffee.  service is quick.  great little gallery but not always with an exhibition on.  clean toilets.  some lovely postcards of Ethiopian art work to buy.,5,January 2016
Simien Mountains National Park,Beautiful place with Beautiful People,"Ethiopia is the second place I visited after China. The landscaping is almost the same in these two countries. The Simien park was a such amazing place with beautiful mountain, wild animals and falls. we meet American couples in Bahir Dar Airport and they gave...",5,July 2018
Simien Mountains National Park,Great trip experience!!,"We spent 3 trekking days in Simien Mountains with amazing views. The National Park is well preserved having the opportunity to stay close to Geladas (monkeys).
During the trip we met a couple of Catalan couple who recommend us to go to the South and...",5,August 2018
Simien Mountains National Park,Michael Teka,The simien national park is the most beautiful place on earth.The wild animals in the park only found in Ethiopia and no where else. The mountains is such beautiful area and water falls too. The trip was so successful and enjoyable thank to Endalk Mulate....,5,October 2017
Simien Mountains National Park,Great 3 days trekking with Dan,"We met Dan in Gondah and he organised us a trip of a life time and everything went very well. He is knowlegable about the area, places to go and on to the simien mountain trekk trips. He speaks good English and He s a...",5,April 2018
Simien Mountains National Park,Fabulous 2 nights / 3 days/ Trek in Simien Mountains!,"We visited Simien Mountains this past August with another couple and had one of the best trips of our lives. We have traveled to many places but none was like  Simien Mountains.
In the first day walking from Simien lodge to the camp we have...",5,August 2018
Simien Mountains National Park,Three day trek with Nur Hassen,"We did a three day trek arranged through simienmountainstour.com. A driver from Gonder, guide, scout, cook and cooks assistant, a mule and two nights on cots in lodges were all included. The hiking was rigorous and fun, though you should give yourself time to acclimatize....",5,August 2018
Simien Mountains National Park,Simien Mountains with Eshete Berju,"I lived for almost one year in Ethiopia and Simien is definitly a unique place to visit! Last year I visited Simien mountains with my parents. We did a three day trekking with a guide, cook and scout. All the logistics (hiring camping gear, food...)...",5,December 2017
Simien Mountains National Park,3 days treck to simiens,"We had a wonderful treck for 2 nights accompanied by a team of a scout (mandatory) a guide (highly recommended) and a cook (amazing). Left from Gondar via Dobark and back,  stunning view in every point. The patch can change (advise with the organizer) but...",5,September 2018
Simien Mountains National Park,Very nice hiking trip in the Simien Mountains!,I went to the Simiens for a 4 day hike. We had a very nice group and our guide Fitalew was very nice and energetic. We climbed to the peak of Mount Buwahit (4430m) and on the way there we saw incredible landscapes and had...,5,February 2018
Simien Mountains National Park,Extraordinary experience and what you should be equipped with for the hike!,We just back after 4 days trip at Simien mountains NP.The walking trail is well  designed along the cliff edge but a bit slippery. you really need to equipped with proper hiking shoes and sun lotion for the strong sun which appeared for a few...,5,September 2018
Yemrehanna Kristos,Very impressive churc inside a natural cave,The experience inside this church is so impressive and unforgettable. You can think your are out of the time and the space inside this timeless church. The calm and silent is so touching!,5,October 2016
Yemrehanna Kristos,A site well worth a visit!,To hear the history behind this church and to visit it is really amazing and I can say that I´m truly impressed by those who built it and those who keep it alive!,5,October 2016
Yemrehanna Kristos,Amazing Architecture,"It's a beautiful place that reflects a lot of history and architecture that is authentically African. Is a must see for individuals interested in architecture and ancient history. I would also recommend a guide as they will talk you through the history, how the palace...",5,October 2016
Yemrehanna Kristos,Atmospheric,"This cave church takes a bit of getting to - you need a guide and driver, as well as the energy for a stiff uphill walk - but it is worth it. Apart from the fascinating stone and wood construction, it's the quietness of the...",5,October 2016
Yemrehanna Kristos,More than I heard!!,"My friends advise me not to miss visiting Yemrehanna Kirstos Church. They also tell me its architectural and Historical leadership at LALIBELA. Yes they are right, I check it, I believe it but it’s more than what I heard.",5,October 2016
Yemrehanna Kristos,cave dwelling,fairly steep and lovely walk on partly paved and partly dirt trail up to this monastry. fascinating to see and a must. Only downer are the kids and beggars which are prolific at the start of the trail and near the top. Well worth the...,4,October 2016
Yemrehanna Kristos,An impressive church built inside a natural cave,"Walking is a but problematic at such height (2600 meters) but the church is nice, and if you get the chance to be there at a special occasion - local funeral and the such, this becomes a lively place and a part pf living tradition.",4,October 2016
Yemrehanna Kristos,Very worth the ride,The drive to get there is long but the landscape is wonderful and the site fantastic. The church itself sits in a huge cave and is older than those in Lalibela. The inside has frescoes and beatiful wood work. A suggestion: if you have empty...,5,October 2016
Yemrehanna Kristos,Wonderful Day in the Country,Kristos is about 1 1/2 hours from Lalibela. Definately a must for anyone interested in all the Churches. The path up to the location of the Church can be a bit strenuous but well worth the climb. The path and stairs are all cobblestone a...,5,August 2016
Yemrehanna Kristos,We were amazed,It was quite a long journey to get to the church from Lalibela as the road was not good in a number of places but the scenery was magnificent and all the local people were walking to market with their livestock to sell.There is an...,4,August 2016
Ethnological Museum,Interesting Artificats But Little Context,"Although the museum is nice...I would recommend a knowledgeable guide to get the most out of it.  Most exhibits aren't well documented with context, so its tough to really understand how amazing the artifacts are you are looking at.",3,June 2012
Ethnological Museum,Ethnological Museum,Museum and getting there welll worth the experience,4,June 2012
Ethnological Museum,Very Historical Museum,I really liked the guide that the museum has on staff. He was very knowledgeable and able to answer all the questions I had. cant wait to visit again.,4,April 2012
Ethnological Museum,"Etnography, Icons and the rooms of the former Emperor",One of the most impressive museums in Africa (South of Cairo),5,May 2012
Ethnological Museum,Best Museum in Addis,"Walk through the beautiful Campus of Addis University and find this old palace of Haile Silase. The best part is the exhibit on the various tribal people of Ethiopia, arranged by life events (creation, birth, adolescence, marriage, death). A fantastic introduction if you are going...",5,April 2012
Ethnological Museum,Very well done!,"At times the museum might be a bit superficial (jumping from one ethnic group/religion/subject to another), but in general they've done an amazing job with the layout (based upon life cycles) and with the limited space they have for such a huge topic...the staff are...",4,May 2012
Ethnological Museum,Excellent museum of former emperor palace,"It used to be the Palace for the last Emperor of Ethiopia and now one of the main universities in Ethiopia. But, part of the university is still reserved as a museum to show the lives of the emperor and artifacts of the royal. Even...",5,April 2012
Ethnological Museum,former emperor palace,"you will find just a former palace, in the middle of addis university, just a small place with a feel spaces",3,April 2012
Ethnological Museum,Worth a visit for the building as well as the museum,"Basically three museums, that of the palace, the ethnological collection and the art/music gallery. The history of the palace provides great insights as to the regime changes which took place in Ethiopia across the 20th century while the museum provides a somewhat traditionalist anthroplogist overview...",4,March 2012
Ethnological Museum,"A little bit rough and ready, but `Lucy` was worth the visit","Needs some money spending on it, but very interesting and `Lucy` is a must. That`s the oldest human skelleton in the world, found in Ethiopia, the `birthplace of mankind`.",3,March 2012
Red Terror Martyrs Memorial Museum,Red Terror Martyrs Memorial Museum,All against Mengistu and what he did in the period of his regime from 3 February 1977 – 10 September 1987,3,September 2016
Red Terror Martyrs Memorial Museum,Haunting,My husband and I visited this museum in December and were haunted for days.  Our guide was a survivor of the Derg and he gave us a very graphic account of this atrocious time in Ethiopian history.,5,December 2015
Red Terror Martyrs Memorial Museum,Red teroor museum,"Museum matters. We think the museum is most important and interesting in Addis Ababa.
Describes the corrupt government during communist dictator Mengistu Authority.",5,September 2016
Red Terror Martyrs Memorial Museum,Worth a visit,"It's a very small museum and can be completed in less than an hour. However, you come away with some of the history.",4,September 2016
Red Terror Martyrs Memorial Museum,Interesting and moving museum,A really interesting museum about a time in Ethiopia's history I knew nothing about! I was really moved by the exhibitions and stories. It would have been even better if there was slightly more information to read.,4,September 2016
Red Terror Martyrs Memorial Museum,"""Dark Years' History"" I'd call it, a history you'll find yourself happy to learn about but sad to know it even happened.","You'd get into the museum like any other museums, to learn the history of the past, a history you would regret it ever happened in the history of humanity. I would call the history in this museum ""Dark Years' History"". It's worth visiting but be...",5,May 2016
Red Terror Martyrs Memorial Museum,"Interesting, may have been better with a guide","I walked through here for about an our one day. Not so much in terms of explanation, but interesting. I didnt have a guide and that would have been helpful.",3,August 2016
Red Terror Martyrs Memorial Museum,Very sad...,"This is a history of Ethiopia that everyone needs to learn about, very dark and disturbing. 

Very enlightening and the guide was very generous with the facts and tidbits about the whole period.

Definitely a must visit.",5,September 2016
Red Terror Martyrs Memorial Museum,Worth a visit - you will learn much,"A small but powerful display, through photo and artifacts, of the 1970s and 1980s in Ethiopia, when mass murder was perpetuated my the military leaders.",5,August 2016
Red Terror Martyrs Memorial Museum,"Interesting but disturbing museum, small so can do in an hour or 2.",Very interesting and moving museum about a difficult period in Ethiopian history.  Would be nice if there are guides but I did have a local Ethiopian friend who was able to give me some of the relevant history.  Done tastefully but did not hold back...,5,August 2016
National Museum of Ethiopia,Underwhelming ,So many great artifacts but the displays are dated and the overall atmosphere is dreary.  2 hours is plenty of time here. Keep an eye on valuables as there were two characters who were asked to leave the museum as they seemed to be stalking...,2,May 2018
National Museum of Ethiopia,Worth a visit,"Last time I was in Ethiopia (2017), this Museum was undergoing much needed renovations (at long last! My 1st visit there dates back to December 2011). I was always saddened to see treasures such as the throne of one the country's oldest emperor covered with...",5,July 2017
National Museum of Ethiopia,Stop texting your “Ex” and go see Dinknesh (Lucy),"It’s not every day you get a chance to see a world treasure. If you call her by her Ethiopian name - Dinknesh, you’ll be surprised by what happens.",4,May 2018
National Museum of Ethiopia,Museums,"Nice place to see about not well looked after
A must to see once in Ethiopia

Bit of a drive to hectic traffic",5,September 2017
National Museum of Ethiopia,Lucy,"Lucy is the highlight but they also have nice other artifacts and a good way to learn about Ethiopia’s history , I think it would be an important place to visit.",4,June 2018
National Museum of Ethiopia,Interesting and only 10 birr to visit as a 'forenji',"Great museum, especially downstairs where Lucy is as there is more explanation about the different objects. Easy to get to, 10 minute walk from arat kilo",5,December 2017
National Museum of Ethiopia,Museum,Could have been so good but it was not. The lighting and quality of displays were disappointing. Sure Lucy is in the basement and you can get a glimpse of her when the iphones batteries fail. Not much care in the displays.,2,May 2018
National Museum of Ethiopia,Quite the place,"They have all of the original bones - Lucy - everything.  Its not the biggest museum, but I've gone twice now and both times it was worth the visit...",5,March 2018
National Museum of Ethiopia,Worth seeing Lucy but not much else.,Impressively small for the National Museum of such a large and historically significant country. Items there are not well preserved except for the bones of Lucy. Takes an hour or less to see.,3,May 2018
National Museum of Ethiopia,Lots to see,"I guess everyone who visits Addis needs to see Lucy, the famous skeleton found by Leaky.  I was underwhelmed - but I did enjoy the display of famous emperors of Ethiopia, with all their finery.",3,July 2017
National Museum of Ethiopia,Luccie,"It is very nice place to be I sow one of hostraropitec person whose name luccie it was amaizing,it was in Addis ,hhhhhhhjjjjjjhhh+bhhhhhhhhh",4,October 2019
National Museum of Ethiopia,Good bit of history,The museum is nothing spectacular but its got a good amount of Ethiopian history which is interesting.,3,October 2019
National Museum of Ethiopia,Museum,"Some interesting exhibits. Most interesting is the reconstruction of ""Lucy"". Whole building feels super rundown, but the entry fee was super cheap. Can't have it both ways I guess.",3,September 2019
National Museum of Ethiopia,"The collection is a mix, well-worth an engaged visit","The museum is located in very pleasant green grounds, and houses quite a range in its collection - from pre-historic to the contemporary. Well-worth getting a guide. Allow at least 2 hours for a thorough look. Apart from the famed ""lucy"" skeleton, there are others...",5,October 2019
National Museum of Ethiopia,Interesting building but a dump. ,"Museums as a whole in Ethiopia are rubbish so my recommendation is just to avoid them all. If you do a day tour insist on not visiting a single one. Most are poorly lit, covered in dust, no curation and full of a lot of...",1,October 2019
National Museum of Ethiopia,Small & interesting ,"My friend & I took a day tour of Addis Ababa. Our guide took us here for a visit. Obviously, Lucy is the draw. Apparently her bones are too fragile to be displayed so there are very good facsimiles. There are also art exhibits and...",4,September 2019
National Museum of Ethiopia,National museum ,"National museum of Ethiopia is only 4 km from Bole airport. Blue white taxi will cost between 100-150 birr, with local transport only 3 birr one way",4,October 2019
National Museum of Ethiopia,Basic,Ethiopia has so much history and this museum does not do it justice. Old fashioned and dull. Lucy is the star attraction but her story was not told well.,3,October 2019
National Museum of Ethiopia,Also known as Lucy's Museum,Definitely worth seeing.  Quite shabby but definitely go.  We went to all the floors with a guide.  I would suggest you get a knowledgeable guide to explain things the writen explanations do not cover.,5,October 2019
National Museum of Ethiopia,Tired but informative,"This was a good, small museum that we could get through fairly quickly and clear quite a bit. I would say that it was worth the time!",4,October 2019
Rock-Hewn Churches of Lalibela,It should be visited once in a life time!,"I have visited Lalibela five times. The rock hewn churches are so marvelous enough.The 11 rock hewn churches are believed the socalled Jerusalem and each of the  them are similar to  the Jerusalem's churches.The design, the colorful painting and the astonishing churches can catch visitors...",5,August 2016
Rock-Hewn Churches of Lalibela,Absolutely Fantastic Destination,"With all the images and writing available for the rock hewn churches, it could be difficult for them to meet expectations.  The entire site succeeds beyond any expectations you could have.  There is well experienced organization with guides licensed and a visitor center that makes...",5,July 2016
