Destination Name,Review Head,Review Body,Rating,Date
Bale Mountains,Amazing Bale Mountains,"Our recent visit to Dinsho and Bale Mountains National Parks including the Sanetti Plateau and Harenna Forests was substantially improved by our guide Ayuba Ahmed.  Ayuba was not only adept at finding the rare animal and bird life of the area, but through his depth...",5,September 2019
Bale Mountains,Unforgettable Days in Bale Mountains,"I and my friends were looking for a responsive, customer oriented tour operator for our 5 days trekking in Bale Mountains and we were very fortunate to have Armaye as our organizer. (WhatsApp +251927336488). On the first day he took us around the park Headquarters...",5,August 2019
Bale Mountains,Amazing trip,"The hike was great, real opportunity to connect with the nature and get to see animals so up close. Ayuba and the crew are awesome and very helpful guides. Absolutely must do trip!",5,August 2019
Bale Mountains,Beautiful nature with no tourists - extraordinary,"We spent 3 days in Bale Mountains and except for one couple in the first starting camp we have not met any tourists at all. The nature is beautiful, pure, untouched. We saw wolfs, eagles and other animals. Accommodation is simple, in tents, but the...",5,May 2019
Bale Mountains,Unique Natural Area,"Bale Mountains National Park near Goba, Ethiopia, is a unique, wonderful place.  It is unlike anywhere I've visited.  I certainly plan to return!",5,January 2019
Bale Mountains,Beautiful landscapes and upclose wildlife,"We had a great time during our three day trip to Bale Mountains. The scenery and wildlife are simply beautiful and definitively worth a visit, even if you've been to the Simien Mountains. 

Our guide Jamal (+251 91 276 7179) was really great. He also...",4,June 2019
Bale Mountains,Wonderful trip to Bale Mountains,I enjoyed an outstanding trip to Bale Mountains National Park in Ethiopia with Ayuba from Bale Mountains Ecotours as our guide. We went trekking for several days near Dinsho and then visited the Sanetti Plateau and Harenna Forest. The wildlife viewing was incredible (highlights were...,5,May 2019
Bale Mountains,memorable trip to Bale Mountains,"First of all: Visit Ethiopia! It is a very beautiful country (culture, great variety of landscapes) with really nice people, always ready to help. 

I absolutely wished to visit Bale Mountains, because, in contrary to Simien Mountains, there is a wide variety in animal- and...",5,January 2018
Bale Mountains,Incredible scenery and wildlife,"I recently visited Bale Mountain national park as well as the Harena forest and Dinsho. I came in part to  see the highly endangered Ethiopian wolf as well as other endangered endemics such as the mountain Nyala, Bohor reedbuck, Menelik's bushbuck, bale monkeys and the...",5,February 2018
Bale Mountains,Spectacular horse riding trek,We spent 4 days at end of January horse riding and camping in the Bale Mountains national park with local guide Ayuba of Bale Mountains Ecotours (also called Bale Trails). It was an extraordinary trip and highlight of our 3 weeks in Ethiopia. We started...,5,January 2018
Bale Mountains,"The Best Trip Ever, Just Absolutely Perfect!","We planned our 6 days trip to Ethiopia through Armaye Ethiopia Tours, basically looking at the Trip Advisor reviews and comparing with other companies, you see there are many of them making it difficult to choose, but it is ranked among the best and is...",5,January 2018
Bale Mountains,Great for nature lovers,"This is a very cold place, but you will love it after the hot and dusty plains of Omo Valley. We stayed for 3 nights in Roba, and went by car to Sanetti for two days. During this time we managed to spot at least...",5,January 2018
Bale Mountains,Three days trekking in stunning surroundings,"We recently did a three day trek in Bale Mountains organised by Armaye Ethiopia Tours, and would definitely recommend this trip and Armaye as a guide. Our flight into Addis was delayed so we came a day late, but Armaye was very flexible and did...",5,October 2017
Bale Mountains,Breathtaking Scenery and Wildlife,We are couples from Germany who are completed Bale Mountains Trekking in early September. Armaye Ethiopia Tours arranged us the trekking tour and we had an amazing experience. Armaye our guide and operator was so considerate and attentive. He provided us with a tailor made...,5,September 2017
Bale Mountains,Amazing place ,"Me and my friends were at bale mountain national park for trekking for few days and the landscape there is amazing even it's not easy to see the animals. And our guide was not friendly and we got lost in the park few times, and...",3,October 2017
Bale Mountains,Truly a park of many worlds,"The Bale Mountains was an absolutely unforgettable experience. We chose to go with our wonderful guide, Armaye Negalign, and he was excellent. Although we went during the rainy season, the weather was surprisingly fair and no rain hit us except on the last day. We...",5,July 2017
Bale Mountains,Fantastic Trekking Experience and Great Service,"We are a group of 3 hikers just completed a trekking to Bale Mountains, since the very beginning Armaye at Armaye Ethiopia Tours provided us amazing service more than we expected. He was very helpful and easily contactable person. I found him via posts and...",5,February 2017
Omo National Park and River,Omo valley with Robel hailu,"First contact details Robel hailu driver and guide 
What’s up number. +251912707956
Email. SOL770084@yahoo.com

I enjoyed 4 days tour. I met Dorze, tribes  Hamar, tribes Karo,tribes  Dasanechi,tribes  Mursi tribes Luckily I was able to see bull jumping of Hamar tribe. Because Robel and Faiza have...",5,February 2019
Omo National Park and River,Trip of a lifetime,"Thank you Robel Hailu, What's up number
+251912707956, Email. SOL770084@yahoo.com
My brother and I were recommended to your services. We are very happy with your itinery this week (6days/5nights). I feel honoured to have experienced South Ethiopia in this way. The photos and videos from this...",5,February 2019
Omo National Park and River,Wonderful tribe journey,"I went there for two weeks. The whole journey at Omo valley tribes was really wonderful. I will never forget it.
I want to write some good words about our guide in Turmi (hamer tribe), his name is Ayke Kala (it.Aykekala@gmail.com)..he was really fantastic, very...",5,February 2019
Omo National Park and River,Beautiful place!,"This place is amazing, beautiful scenery and animals in natural habitat. I was able to see herds of zebras, monkeys and others animals, this place is unique and I love how you can see as far as the eye can see! The tour guide (Wunde)...",5,February 2019
Omo National Park and River,Gech is our guide en we drive for 4 days in the Omovaley,"It was very good  witch him ,he speak witch every local group Koso ,Hamar Dassench
and Mursi,
He know the prices en we are very heappy witch Gech
Ask to hem and believe me ,your trip is GREAT !!!!",5,February 2019
Omo National Park and River,Impressive area,"It's a different world there. I was only 3 days, flying to Jinka from Adis. I did short trips to the Daasanach, and to the area where Homo Sapiens remains were first found by Richard Leakey. My guide Degu was very flexible to accomodate my...",5,January 2019
Omo National Park and River,Omo Valley Southern Tribes,"Our guide was flexible, open minded and reasonable. He changed things when needed and organized a good itinerary. He's a local guy and knowledgeable about the different peoples you will meet. His details:

Solojinka@gmail.com
+251924630484",5,February 2019
Omo National Park and River,Tour in Omo Valley,"I did a 4 days tour in the Omo Valley. My guide was Arone. WhatsAap number        +251 919446868 email: bennarone@gmail.com
In the beggining I started with another guide but I didn´t connect with him and then I met Arone in his Art-Craft Shop at Jinka...",5,November 2018
Omo National Park and River,Go Ethiopia Tours are awesome!,"Amazing 9 day cultural trip in southern Ethiopia

We used Solomon Gezu, Go Ethiopia tours owner/ guide and had a brilliant trip. Himself and his colleague/driver, Sita, took us from Paradise Lodge in Arba Minch through an unforgettable 9 day Omo River area adventure back...",5,January 2019
Omo National Park and River,Amazing trip in Omo Valley!,"With Robel Hailu (What's up number
+251912707956, e-mail. SOL770084@yahoo.com) we visited the Omo Valley for 8 days. I have already visited a lot of countries around the world, but this trip was one of the most amazing experiences. Robel is not only an excellent guide,...",5,January 2019
Fasiladas Bath Timket,Must see in Gondar,This is one of the best preserved historical buildings in Gondar. We were there on 19 December 2014. The pool was being filled in preparation for the Timkat celebrations in January. Impressive! So are the roots of the trees in the complex. Don't forget to...,5,December 2014
Fasiladas Bath Timket,Something magical,Something magical about this place.  The peace and serenity.  The atmosphere is just magical.  It's in great condition and we were lucky the pool wasn't empty so we could take great pics with f fantastic reflection in the water.,5,December 2014
Fasiladas Bath Timket,Well worth visit if you are visiting the castle,This was included in our Explore trip and was amazing to realise the expertise in building this and how they fill the 'pool' with water for the countryside. The exposed roots of the trees were a mini Ta Prohm temple at Angkor Wat.,4,April 2014
Fasiladas Bath Timket,Well worth the time ,"As the price of entry is included as part of the castle complex the bath is certainly worth a visit. The bath and structures are in great condition and beautifully set. 
Make sure you visit on the same day as the ticket because it is...",4,None
Fasiladas Bath Timket,nice but expensive,"place is clean, church is nice. price is a little bit expensive, 200 bir per person without guide , time to visit the church 15 minutes !",4,November 2014
Fasiladas Bath Timket,Interesting place,Every year this huge swiming pool is being filled up and people (piligrims) come from all over the world. The place is not croweded. Old trees with spining roots arroun the swiming pool.,5,November 2014
Fasiladas Bath Timket,Quite A Place,"Fasilades Pool is quite a place any time of year, not just at Timket.  This place oozed with history, tradition and culture.  The banyon trees are fascinating too.  Many photo opps.",4,November 2014
Fasiladas Bath Timket,Good photo opportunities,"Before you go, check out some photos of the Timket (baptism) festival here, and you will have  a much better appreciation of the site. I understand that it's extremely crowded and difficult to get a ticket for the actual ceremony. A GOOD local guide makes...",5,October 2014
Fasiladas Bath Timket,Not special,"When it;s not Timket, i thinks it's not special to see this. But it was very quit! It's difficult to come to here.",3,July 2014
Fasiladas Bath Timket,Beautiful place!,This place really caught my attention. I could imagine it being full of swimmers enjoying a day at the pool. Unfortunately when we were there it was empty. The trees are like something out of Harry Potter and the whole area is very well kept....,5,August 2014
Ethnological Museum,Must-Go Place,"I think that is better to visit this museum at the end of your trip to Ethiopia because this place puts everything in the right context after long trip.
Don't even think to visit without a guide, there are great young guides for free.",5,August 2014
Ethnological Museum,HISTORY......is the best teacher....,"HISTORY IS LIKE WINE....THE OLDER IT GETS THE BETTER...

A very good attempt at the consolidation and exhibition of Ethiopia's cultural and political history under one roof and in Emperor Haile Selassie's palace compound...now housing  the Addis Ababa University...

A great museum with an array...",4,None
Ethnological Museum,Informative and cool,"Very interesting displays from all parts and eras of Ethiopia set in the fascinating palace of Haile Selassie. Lovely grounds and building are wonderful on their own, but each floor, room, corner holds some history or culture to be explored as well.",5,June 2014
Ethnological Museum,This museum is a must!,"First, I love the grounds- in the university, gardens of exotic plants. 
Then the museum is so full of cultural info. Love the instrument room. Unfortunately the music in each section was not working. 
The religious art, Haile Selassie's living quarters, and most of all...",5,June 2014
Ethnological Museum,Interesting insight into Ethiopia's rich cultural heritage,"This museum, located in the spectacular palace grounds on Addis Ababa's University campus, is a delightful way to spend an hour or two. It offers a broad array of photographs, history, artwork and cultural exhibitions, and it also houses the emperor's old living quarters.",4,June 2014
Ethnological Museum,Probably the best all-round Ethiopian experience in Addis,Three (or were there four) floors of relatively well laid out and annotated components making up the very diverse Ethiopian culture in a clean and well lit building.  It is well worth taking a couple of passes at the place when one has nothing to...,4,January 2014
Ethnological Museum,Amazing guide,"I visited here with a friend who is Ethiopian and we were offered an English speaking guide. I wish I had got his name- he was FANTASTIC!!!! So knowledgeable and interesting!
The museum is fascinating, and gives you a real insight into the vast differences...",5,June 2014
Ethnological Museum,good art,"I really liked the Ethiopian art and the ornate crosses on display, as well as the house and gardens the museum is set in. 100 Birr (5 usd) entrance. Ask minibus drivers for the university, or go to Arat Kilo and then go one stop...",4,June 2014
Ethnological Museum,From Palace to University to Museum,"This museum is within what was formerly Haille Selassie's Palace and is now part of the university.  Very interesting insight into the numerous cultures that make up Ethiopia.  Also, was really nice to see groups of school children enjoying their history.",5,June 2014
Ethnological Museum,Excellent museum,"The best museum of those I visited in Ethiopia. Very good exhibits of cultural life in Ethiopia, and a good museum shop as well. Located on university grounds, which is a pleasing area.",4,April 2014
Ethnological Museum,"Very informative, lots to read and see.","This museum is located inside the University of Addis Ababa Sidist Kilo campus, straight ahead when you walk through the gates. It's a little pricy at 50 birr but I think well worth it to a) support the museum/university and b) you get a nosey...",5,August 2012
Ethnological Museum,See this before you go up-country,Unless you are well versed in Ethiopian tribes and ethnic groups this first rate museum will help fill in the gaps while touring this fascinating country,5,May 2012
Ethnological Museum,Glad we went here.,This museum was  excellent. We visited the Ethnological Museum before we toured the historic sights of Ethiopia and doing this gave us a good understanding of what we later saw during our travel.,5,August 2012
Ethnological Museum,Educational and very interesting,"An easy to mange museum that gives an easy introduction to Ethiopia and its place in the evolutionary story. Lucy is there, and there are many elements to Ethiopian culture presented.  You can move through atourown pace, and spend an hour or a full day...",5,May 2012
Ethnological Museum,"Better than the National Museum, but too dark",This museum housed inside the Addis Ababa University has much better displays than the National Museum. The collection in the first floor is a bit poor but has very good information about many topics and you can learn a lot if you read the displays....,3,July 2012
Ethnological Museum,Good museum,Agree that several reviewers are confusing this museum with the Ethiopia History museum which covers human evolution.  This museum is on the campus of Addis Ababa University.  Entrance was 50 birr for forengi's despite my attempts to claim habesha status.  Got a smile for my...,4,July 2012
Ethnological Museum,tops museum about Ethiopian culture,"great museum.  at the Sidist Kilo branch of Addis Ababa university.  walk through the uni gates, straight past the fountain, and up the small hill where you'll see a big house that once belonged to Haile Selassie.  Enter through the front, hang a right and...",5,June 2012
Ethnological Museum,very interesting,"First I'd like to point out that some reviewers have confused this museum with the National Museum.  LUCY is in the National Museum, not this one.  This museum is located in an old palace of Haile Salassie on the current grounds of Addis Ababa University....",4,June 2012
Ethnological Museum,Nice cultural escapade,"If you are in Addis, take some time and do visit this museum. It is worth visiting!",4,July 2012
Ethnological Museum,Very enjoyable to view historical aspects of Ethiopia,An amazing place!  The archeological artifacts housed here were extremely interesting.,5,July 2012
Simien Mountains National Park,Simien Mountains unlike anywhere else,We went during the dry season (January) and were reportedly told how much more lush they are in the fall. But they were still amazing. We did a 4-day trek and agree with others that 5 days does not provide anything above and beyond the...,5,January 2017
Simien Mountains National Park,Overrated.,"Beautiful mountains but distant view is hazy, a long road to reach, no animals except the poor Gelada baboons who are pestered by all who come. We did enjoy seeing them but understood why they avoided us.",3,January 2017
Simien Mountains National Park,Beautiful,"Breathtaking, mind-blowing visit to the Simien Mountains- the landscape and wildlife are incredibly varied. I would recommend spending at least 2 days to take it all in- it's also a really long drive from Gonder so you won't get to fully appreciate in just one...",5,February 2017
Simien Mountains National Park,Seriously fantastic,"So different from anything in the whole wide world. Such a beautiful place, wonderful experience, animals and people along the way. And a serious breathtaking hike, because of the height!",5,April 2016
Simien Mountains National Park,An interesting visit ,"It was a unique experience in an impressive range of mountains thanks to my very kind and helpful guide Dejen who accompanied me through the long and painful journey and trekking to top of the mountain
A necessary prerogative is to be accompanied  by a...",5,February 2017
Simien Mountains National Park,unforgettable scenery,"The Semien Mountains national park is one of Ethiopian UNESCO world heritage site which is located in northern Ethiopia, the stablishment of the park is to protect the endemic mammals of Ethiopia, this park have an Afro Alpian landscape where you can see the spectacular...",4,March 2016
Simien Mountains National Park,Breathtaking,"Wow, what a place! The views will take your breath away (if it hasn't already disappeared with the altitude!) We had 2 full days here as part of a longer trip with Dagi (dagimethiopiatour.com) who we've travelled with for the last 3 visits to Ethiopia....",5,January 2017
Simien Mountains National Park,A True Wildrrness Experience Ethiopian Style,Photographers come here for the magnificent landscapes and the Gelada (bleeding heart) monkeys. It is remote and austere in the dry season but well worth the long journey to experience its unique wildlife and scenery. Treking is a mix of modest and challenging at your...,5,January 2017
Simien Mountains National Park,Simien Mountains. Just out of this world,If you plan to visit Ethiopia. You must go to the Simien Mountains National Park. Just awesome. After reviewing many tour companies. I decided to go with Dezy who runs the Hiking Simien Mountains Company. I'm so extremely happy that I made the right choice....,5,January 2017
Simien Mountains National Park,Amazing Views,Went on a 2 day trek and it was an amazing experience.  I went during the dry season so the 500 m waterfall was dry--you may want to try the wet season-- but these are special mountains it was so worth it-- was just a...,5,January 2017
Rock-Hewn Churches of Lalibela,"Interesting sites, expensive","The churches are grouped into North and South and St George separate. One ticket gets you into them all. I believe it is valid for 5 days, but why you would want that long is beyond me.
The churches have undergone restoration, but much of...",4,November 2015
Rock-Hewn Churches of Lalibela,Definitely the best,"Due to preservation many if the churches in Lalibela are now nearly impossible to photograph.
This church of St George being the exception.
This was the last church built by King Lalibela and the design is clean and interesting. The inside is plain, it is...",5,November 2015
Rock-Hewn Churches of Lalibela,Amazing architecture and Setting,"We really enjoyed visiting the rock-hewn, monolithic churches of Lalibela.  They are truly wonders and very special.  We also loved the setting in Lalibela.  It is a small town high up in the open mountains of Ethiopia.  At night, you can see every star and...",4,September 2015
Rock-Hewn Churches of Lalibela,Nothing like it on earth,Go with an open mind and you will love it. If you're the kind of person that says Stonehenge was smaller than you imagined (or the Pyramids were not as you imagined then you will probably complain about the entrance fee) but if you can...,5,July 2015
Rock-Hewn Churches of Lalibela,"This is a ""must"" visit when you are in Lalibela; it is isolated from other churches and is the most majestic","While the Church of St. George is remarkable, it is also to date not covered by a modern shelter.  It is a symmetrical cruciform shape about 15 meters in height (depth).  They are currently building (or rebuilding and refurbishing)  a ""viewing"" site on the hill...",4,October 2015
Rock-Hewn Churches of Lalibela,"Must see in Ethiopia, guide highly recommended","This is one of the most beautiful sites we visited in out trip in Ethiopia. Full of amazing architecture and cultural significance.
A guide is a MUST here, without one you will miss out on many things that make this site so amazing. We traveled...",4,September 2015
Rock-Hewn Churches of Lalibela,Breath taking UNESCO World Heritage Site,"For all other World Heritage site, they are all above ground. You look for them from far far away. Churches of Lalibela are underground, to me, they are 3 different group, north clusters, south clusters and St George. It is very unfortunate that, the shelter...",5,September 2015
Rock-Hewn Churches of Lalibela,Superb,"The feeling of peace is overwhelming and the history in these churches is amazing. Our tour guide, Alayew Abey (Alex) was great and well worth the fee. We didn't want a long detailed tour, we were more interested in the Coles notes version and wanted...",5,September 2015
Rock-Hewn Churches of Lalibela,The best church in Lalibela,Definetly my favorite. This church has a presence I found lacking in the others. The view as you approach is probably the best and most famous but it was all great.,4,October 2015
Rock-Hewn Churches of Lalibela,Nice but not a mini Petra,"I suppose I expected more, something along the lines of a Petra. Fairly crude workmanship on mostly small buildings. Impressive for being carved from solid rock.",3,October 2015
Wukro Museum,Small museum but worth the visit,"There are only 2 rooms, one with an electric generator and one with archaeological finds from the ancient moon temple found at Meqaber Gaewa. The temple artefacts include a libation altar, statue of a seated woman, incense burners, glass vials, some jewelry/beads, and pottery. There...",5,October 2019
Wukro Museum,Small but insightful visit to the Wukro Archaelogical Museum,This small German-funded museum is a must-see if you are interested in the history of Tigray and of northern Ethiopia as a whole. It does not only contain the power plant of Wukro which was damaged during an air raid in the late 1980s and...,4,February 2019
Wukro Museum,What a surprise - a high quality faclity,I really enjoyed this visit.  The museum is small but very well presented.  What is unusual is the focus on pre-Axomite civilization (also pre-Christianity).  The artefacts are beautiful and amazingly intact.  Worth a visit if you are in the Mekele area.,4,September 2017
Wukro Museum,Small Museum With Big History,"I was thinking that I would visit a small museum like any other in the area but something was absolutely different. I found hundreds of things, artifacts, and archaeological findings, so pure, original and intact. This museum is a ""must-go"" especially for those that love...",5,April 2016
Wukro Museum,Review of Wukro Museum in Tigrai,One would not expect to find such an interesting museum as this in Wukro. There are a lot of interesting archeological artefacts and detailed written descriptions of the work and the archeology of the area. I would strongly recommend a visit to the museum if...,4,April 2016
Wukro Museum,A most bizarre afternoon!,"This is a new museum and we were amongst its first visitors, although everything was already covered in a thick layer of dust, including the toilets which had no water in them! The museum is a German-funded project and has some of the features you...",3,February 2016
Wukro Museum,Lovely new museum in the heart if Tigray,"This museum opened in October 2015 and shows the artefacts from 3 archeological excavations nearby. It also has a huge diesel generator which the local people bought to provide electricity.
It is a lovely building with a very proud and well informed staff, the manager...",5,November 2015
